{
  "$schema": "https://json-schema.org/draft/2020-12/schema",
  "title": "azooKey Windows TSF MVP settings",
  "type": "object",
  "properties": {
    "profilesByApp": {
      "type": "object",
      "default": {},
      "additionalProperties": {
        "type": "object",
        "additionalProperties": false,
        "properties": {
          "bracketPairing": {"type": "string", "enum": ["auto", "on", "off"], "default": "auto"},
          "profileName": {"type": "string", "default": ""},
          "predictionEnabled": {"type": "boolean", "default": true},
          "sentenceCompletion": {"type": "boolean", "default": false},
          "learningEnabled": {"type": "boolean", "default": true},
          "aiBackend": {"type": "string", "enum": ["auto", "local-zenzai", "openai", "none"], "default": "auto"},
          "promptPrefix": {"type": "string", "default": ""},
          "style": {"type": "string", "enum": ["auto", "polite", "casual", "technical"], "default": "auto"},
          "preferTechnicalTerms": {"type": "boolean", "default": false},
          "candidateTagBoosts": {
            "type": "object",
            "default": {},
            "additionalProperties": {"type": "number", "minimum": 1.0, "maximum": 3.0}
          },
          "privacyMode": {"type": "string", "enum": ["inherit", "normal", "private", "secure"], "default": "inherit"}
        }
      }
    },
    "bracketSymmetricQuotePairing": {"type": "boolean", "default": false},
    "bracketWrapSelection": {"type": "boolean", "default": false},
    "bracketPairingAppPolicy": {
      "type": "string",
      "enum": ["denylist", "allowlist"],
      "default": "denylist"
    },
    "bracketPairingApps": {
      "type": "array",
      "items": {"type": "string"},
      "default": []
    },
    "bracketPairsPath": {
      "type": "string",
      "default": "",
      "description": "M61-B: カッコ対 TSV。空なら LOCALAPPDATA/azooKey/bracket-pairs.tsv。相対パスは azooKey データディレクトリ基準"
    },
    "bracketPairing": {
      "type": "boolean",
      "default": false,
      "description": "M61-A: 自動カッコペアリングのマスタースイッチ。TIP ローカルで判定"
    },
    "bracketPairingTrigger": {
      "type": "string",
      "enum": ["immediate", "composition"],
      "default": "immediate",
      "description": "M61-A: 即時挿入またはカッコ対の preedit 表示"
    },
    "bracketSkipOverClosing": {
      "type": "boolean",
      "default": true,
      "description": "M61-A: 同じ閉じカッコが直後にあるとき飛び越える"
    },
    "bracketBackspaceDeletesPair": {
      "type": "boolean",
      "default": true,
      "description": "M61-A: 空のカッコ対を Backspace で一括削除"
    },
    "bracketPairingInAlnumMode": {
      "type": "boolean",
      "default": true,
      "description": "M61-A: 英数モードでも自動カッコペアリングを適用"
    },
    "inputMode": {
      "type": "string",
      "enum": ["hiragana", "alnum_half", "alnum_full"],
      "default": "hiragana"
    },
    "convertKeysAction": {
      "type": "string", "enum": ["default", "imeOnOff"], "default": "default",
      "description": "DEV-1736: imeOnOff で変換キーを IME オン、無変換キーを IME オフにする（再変換と字種の巡回には使わない）"
    },
    "liveConversion": {
      "type": "boolean",
      "default": false,
      "description": "Phase 5 (M14): true で Composing 中に候補ウィンドウを抑制し Preedit にライブ最良候補を表示"
    },
    "dynamicPunctuation": {
      "type": "boolean", "default": false,
      "description": "M59: ライブ変換中の動的自動句読点"
    },
    "dynamicPunctuationStyle": {
      "type": "string", "enum": ["ja", "fullwidth_latin"], "default": "ja",
      "description": "M59: 自動句読点の字種"
    },
    "dynamicPunctuationStability": {
      "type": "string", "enum": ["onPause", "eager"], "default": "onPause",
      "description": "M59: 自動句読点の挿入タイミング"
    },
    "dynamicPunctuationIdleMs": {
      "type": "integer", "minimum": 1, "maximum": 2147483647, "default": 400,
      "description": "M59: onPause の入力停止判定ミリ秒"
    },
    "segmentBoundaryConfidence": {
      "type": "number", "minimum": 0.0, "maximum": 1.0, "default": 0.5,
      "description": "M59: 読点を許す文節境界信頼度の下限"
    },
    "punctuationConversion": {
      "type": "string", "enum": ["off", "commit"], "default": "off",
      "description": "DEV-1638: commit で句読点（、。）キーが直前の読みを第 1 候補へ変換し句読点と一緒に確定"
    },
    "punctuationRulesPath": {
      "type": "string", "default": "%LOCALAPPDATA%\\azooKey\\punctuation-rules.tsv",
      "description": "M59: 句読点規則 TSV ファイルのパス"
    },
    "llmMagicConversion": {
      "type": "boolean",
      "default": false,
      "description": "MVPでは無効固定。Phase 5 (M16) で aiBackend 経由で有効化"
    },
    "logLevel": {
      "type": "string",
      "enum": ["error", "warn", "info", "debug"],
      "default": "info"
    },
    "inputStyle": {
      "type": "string",
      "enum": ["default", "custom"],
      "default": "default",
      "description": "Phase 5 (M17): default=内蔵ローマ字テーブル / custom=customRomajiTablePath を読み込む"
    },
    "customRomajiTablePath": {
      "type": "string",
      "default": "%LOCALAPPDATA%\\azooKey\\custom-romaji.tsv",
      "description": "Phase 5 (M17): カスタムローマ字 TSV ファイルのパス。ホットリロード対応"
    },
    "predictionEnabled": {
      "type": "boolean",
      "default": true,
      "description": "Phase 5 (M15): 予測候補ウィンドウを表示。OFF で PredictionWindow を生成しない"
    },
    "aiBackend": {
      "type": "string",
      "enum": ["none", "openai", "local-zenzai"],
      "default": "none",
      "description": "Phase 5 (M16): AI 変換バックエンド。Phase 6-B (M24) で local-zenzai を有効化"
    },
    "openAiTimeoutMs": {
      "type": "integer", "minimum": 1000, "maximum": 120000, "default": 30000,
      "description": "M16/M58-C: 再試行を含むAIリクエストの全体期限（ミリ秒）"
    },
    "privacy": {
      "type": "object", "additionalProperties": false, "default": {},
      "properties": {
        "mode": {"type": "string", "enum": ["normal", "private", "secure", "offline", "custom"], "default": "normal"},
        "redactLogs": {"type": "boolean", "default": true},
        "crashReportConsent": {
          "type": "string", "enum": ["off", "local"], "default": "off",
          "description": "障害診断の明示的な保存同意。localは例外コード等の最小メタデータだけを端末内に保存し、本文・メモリ・スタックは収集しない。自動送信は行わない"
        },
        "custom": {
          "type": "object", "additionalProperties": false, "default": {},
          "properties": {
            "learning": {"type": "boolean", "default": false},
            "prediction": {"type": "boolean", "default": true},
            "aiCandidate": {"type": "boolean", "default": true},
            "externalAi": {"type": "boolean", "default": false},
            "detailedLogging": {"type": "boolean", "default": false}
          }
        },
        "autoSecureInput": {
          "type": "boolean", "default": true,
          "description": "M46: secureApps・パスワード欄・入力先解決不能による自動secure判定を有効にする。falseでもIME無効化への追従とAI入力ゲートは維持する"
        },
        "secureApps": {
          "type": "array", "items": {"type": "string"}, "default": [],
          "description": "M46: 自動secure判定に使うユーザー追加の実行ファイル名（basename）。バンドル既定リストは再掲せず、実効判定は既定との和集合。照合は大文字小文字を無視する"
        },
        "showSecureIndicator": {
          "type": "boolean", "default": true,
          "description": "M46: secure中であることをユーザーへ表示する（候補ウィンドウ右端の🔒と突入時のtoast）。falseでも抑止は変わらない"
        }
      },
      "description": "共有AI基盤の送信許可とM46のsecure判定。secureはAI禁止、private/offlineはローカルのみ。secureUrlPatterns・privateApps等の残りのM46軸は別途実装"
    },
    "openAiApiKey": {
      "type": "string",
      "default": "",
      "description": "Phase 5 (M16): aiBackend=openai のとき使用。Phase 7 (M34) で DPAPI 暗号化 ('dpapi:' prefix)"
    },
    "openAiApiEndpoint": {
      "type": "string",
      "default": "https://api.openai.com/v1",
      "description": "Phase 5 (M16): OpenAI 互換エンドポイント"
    },
    "openAiModel": {
      "type": "string",
      "default": "gpt-4o-mini",
      "description": "Phase 5 (M16): OpenAI 互換 model 名"
    },
    "includeContextInAITransform": {
      "type": "boolean",
      "default": true,
      "description": "Phase 5 (M16): AI 変換時に前後文脈（直近 paragraph）を含める"
    },
    "contextReselection": {
      "type": "boolean",
      "default": false,
      "description": "rich X-3-2: 同音異義語の文脈再選択を有効化（実験機能）"
    },
    "postCommitLint": {
      "type": "boolean",
      "default": false,
      "description": "rich X-3-3: 確定後の誤変換検出と波線表示を有効化（実験機能）"
    },
    "retroactiveRecompute": {
      "type": "boolean",
      "default": false,
      "description": "rich X-1-3: 後戻り再評価を有効化（800ms idle で全体再評価）"
    },
    "sentenceCompletion": {
      "type": "boolean",
      "default": false,
      "description": "rich X-2-1: 文単位の予測（Sentence モード）を有効化"
    },
    "backendPreference": {
      "type": "string",
      "enum": ["auto", "cpu", "cuda", "vulkan", "winml", "directml", "npu"],
      "default": "auto",
      "description": "Phase 6-B (M24): 推論エンジン選択。auto は Host 起動時に docs/copilot-pc-backend-spec.md §4.4 の BackendSelector が R1 の vulkan / cpu から選ぶ（cuda は選ばない。R2 は保留中）。winml は ONNX+Windows ML 経路で具体 EP を自動選択。vulkan は R1 ggml-vulkan（ベンダ横断 GPU フォールバック、ggml-vulkan ビルド要）。directml/npu は非推奨（互換のため受理し内部的に winml にマップ）"
    },
    "epPreference": {
      "type": "string",
      "enum": ["auto", "npu", "gpu", "cpu"],
      "default": "auto",
      "description": "Phase 6-B (M24): backendPreference=winml(R2) 時の Windows ML EP 希望。docs/copilot-pc-backend-spec.md §4.4。root tier。model.epPreference があればそちらが優先（docs/model-management-spec.md §5.2）"
    },
    "model": {
      "type": "object",
      "description": "Phase 6-C (M45): モデル管理タブ設定。docs/model-management-spec.md §7。model.* は root の同名キー(backendPreference / epPreference)を上書きする（§5.2）",
      "properties": {
        "enabled": { "type": "boolean", "default": true },
        "selectedPath": { "type": "string", "default": "" },
        "backendPreference": {
          "type": "string",
          "enum": ["auto", "cpu", "cuda", "vulkan", "winml", "directml", "npu"],
          "default": "auto",
          "description": "docs/model-management-spec.md §5.1。auto は root backendPreference に従う（解決は docs/copilot-pc-backend-spec.md §4.4）。vulkan は R1 ggml-vulkan（ベンダ横断 GPU フォールバック）。directml/npu は非推奨・winml に統合（互換受理し内部 winml マップ）"
        },
        "epPreference": {
          "type": "string",
          "enum": ["auto", "npu", "gpu", "cpu"],
          "default": "auto",
          "description": "backendPreference=winml(R2) 時の EP 希望。docs/copilot-pc-backend-spec.md §4.4"
        },
        "nGpuLayers": { "type": "integer", "default": -1, "description": "R1(llama.cpp) 専用。-1=全レイヤ GPU / 0=CPU only / 正値=部分オフロード" },
        "autoLoadOnHostStart": { "type": "boolean", "default": true },
        "fallbackToSimpleConverter": { "type": "boolean", "default": true },
        "benchmarkOnModelChange": { "type": "boolean", "default": false },
        "benchmarkHistory": {
          "type": "array",
          "default": [],
          "maxItems": 7,
          "description": "Host が終了順に保存する BenchmarkModel の直近7件。保存・互換性は docs/model-management-spec.md §7.1。",
          "items": {
            "type": "object",
            "required": ["path", "completedAt", "backend", "status", "p50_ms", "p95_ms", "p99_ms", "load_ms", "rss_mb", "vram_mb", "iterations_completed", "error"],
            "properties": {
              "path": { "type": "string", "minLength": 1, "pattern": "^(?:[A-Za-z]:[\\\\/]|[\\\\/]{2}[^\\\\/]+[\\\\/]|/)" },
              "completedAt": { "type": "string", "format": "date-time", "pattern": "^[0-9]{4}-[0-9]{2}-[0-9]{2}T[0-9]{2}:[0-9]{2}:[0-9]{2}Z$" },
              "backend": { "type": "string", "enum": ["cpu", "cuda", "vulkan"] },
              "status": { "type": "string", "enum": ["success", "timeout", "error"] },
              "p50_ms": { "type": "number", "minimum": 0 },
              "p95_ms": { "type": "number", "minimum": 0 },
              "p99_ms": { "type": "number", "minimum": 0 },
              "load_ms": { "type": "number", "minimum": 0 },
              "rss_mb": { "type": "number", "minimum": 0 },
              "vram_mb": { "type": ["number", "null"], "minimum": 0 },
              "iterations_completed": { "type": "integer", "minimum": 0, "maximum": 4294967295 },
              "error": { "type": ["string", "null"] }
            },
            "additionalProperties": false
          }
        }
      },
      "additionalProperties": false
    },
    "powerProfile": {
      "type": "string",
      "enum": ["auto", "performance", "battery_saver"],
      "default": "auto",
      "description": "Phase 6-B (M25): 電源プロファイル。auto は AC/バッテリ自動判定"
    },
    "inferenceThreads": {
      "type": "integer",
      "minimum": 0,
      "maximum": 8,
      "default": 0,
      "description": "DEV-406 / DEV-946: 推論スレッド数。1〜8の明示値を優先する。0はpowerProfileに従い、autoはAC時8、バッテリ時2、状態不明時4、performanceは8、battery_saverは2を基準として、ハードウェア並列度で上限化する。並列度0は1へフォールバックする"
    },
    "maxCandidates": {
      "type": "integer",
      "minimum": 1,
      "maximum": 32,
      "default": 9,
      "description": "DEV-406: 1 回の変換で返す候補数の上限"
    },
    "maxContextLength": {
      "type": "integer",
      "minimum": 0,
      "maximum": 30,
      "default": 30,
      "description": "DEV-406: 推論へ渡す左文脈の Unicode コードポイント数。0 は左文脈を渡さない"
    },
    "promptPrefixByApp": {
      "type": "object",
      "default": {},
      "additionalProperties": { "type": "string" },
      "description": "rich X-2-6: 前面アプリ実行ファイル名 → prompt prefix のマップ（例: 'Code.exe', 'OUTLOOK.EXE'）"
    },
    "batchRomajiConversion": {
      "type": "boolean",
      "default": false,
      "description": "M58-A: true でローマ字を蓄積し最後に一括変換するモードを有効化。蓄積中は候補/予測/ライブ変換の IPC を発火しない"
    },
    "batchRomajiPreviewStyle": {
      "type": "string",
      "enum": ["kana", "romaji"],
      "default": "kana",
      "description": "M58-A: 蓄積中 Preedit の表示。kana=ローマ字→かなプレビュー / romaji=生ローマ字をそのまま表示"
    },
    "batchConversionMode": {
      "type": "string",
      "enum": ["neural", "ai-cleanup"],
      "default": "neural",
      "description": "M58-A/M58-C: 一括変換の処理系。neural=zenz かな漢字変換 / ai-cleanup=aiBackend で誤字補正・句読点挿入・整文"
    },
    "batchAutoPunctuation": {
      "type": "boolean",
      "default": false,
      "description": "M58-C: batchConversionMode=ai-cleanup 時に句読点を自動挿入"
    },
    "inlineEnglishCandidates": {
      "type": "boolean", "default": false,
      "description": "M60: 日本語ローマ字入力中に英単語候補を候補列へ注入する"
    },
    "mixedEnglishAutoConversion": {
      "type": "boolean", "default": false,
      "description": "M63: 日英混在のローマ字を区間ごとに打ち分け、確度の高い英単語をライブ変換と第 1 候補で英字にする。inlineEnglishCandidates が true のときだけ働く"
    },
    "inlineEnglishCaseVariants": {
      "type": "boolean", "default": true,
      "description": "M60: 先頭大文字 / 全大文字バリアントも候補に出す"
    },
    "fullWidthEnglishCandidate": {
      "type": "boolean", "default": false,
      "description": "M60: 全角ローマ字候補も出す"
    },
    "inlineEnglishMinLength": {
      "type": "integer", "minimum": 1, "default": 2,
      "description": "M60: 英単語候補を出す生ローマ字の最小長"
    },
    "inlineEnglishPromoteThreshold": {
      "type": "number", "minimum": 0.0, "maximum": 1.0, "default": 0.6,
      "description": "M60: 英語意図スコアがこの値以上で英単語候補を日本語第 1 候補の直後へ上げる"
    },
    "inlineEnglishDictionary": {
      "type": "boolean", "default": false,
      "description": "M60: 英単語辞書によるランキング・ゲーティングを有効化（OFF でも生ローマ字と大文字化は出る）"
    },
    "inlineEnglishDictionaryPath": {
      "type": "string", "default": "%LOCALAPPDATA%\\azooKey\\dict\\english-words.tsv",
      "description": "M60: 英単語辞書 TSV のパス"
    },
    "numberRewriter": {
      "type": "boolean",
      "default": false,
      "description": "M62-A: true で純十進数字の候補へ漢数字、大字、丸数字、ローマ数字、16進数、8進数、2進数を注釈付きで追加"
    },
    "katakanaRewriter": {
      "type": "boolean",
      "default": false,
      "description": "M62-B: true で純ひらがなの候補へ全角カタカナと半角カタカナを注釈付きで追加"
    },
    "symbolRewriter": {
      "type": "boolean", "default": false,
      "description": "M62-C: 記号のかな読み引きと関連候補の展開"
    },
    "symbolDataPath": {
      "type": "string", "default": "",
      "description": "記号 TSV のパス。空文字列は Host と同階層の data/symbol.tsv"
    },
    "emojiRewriter": {
      "type": "boolean", "default": false,
      "description": "M62-D: 絵文字のかな読み引きと trigger 検索"
    },
    "emojiTriggerSearch": {
      "type": "boolean", "default": true,
      "description": "絵文字リライター有効時に :trigger 検索を使用"
    },
    "emojiMaxCandidates": {
      "type": "integer", "minimum": 1, "maximum": 50, "default": 12,
      "description": "trigger 検索の候補数上限"
    },
    "emojiTriggerMinQueryLength": {
      "type": "integer", "minimum": 1, "maximum": 8, "default": 1,
      "description": "trigger 検索を始める最小文字数"
    },
    "emojiDataPath": {
      "type": "string", "default": "",
      "description": "絵文字 TSV のパス。空文字列は Host と同階層の data/emoji.tsv"
    },
    "typoCorrectionMode": {
      "type": "string",
      "enum": ["off", "suggest", "auto_replace"],
      "default": "suggest",
      "description": "M35: 個人のタイプミス傾向を学習し修正する動作モード。docs/typo-correction-learning-spec.md section 8"
    },
    "typoMinCount": {
      "type": "integer", "minimum": 1, "maximum": 100, "default": 3,
      "description": "M35: 同じ打ち間違えペアをこの回数観測してから補正候補に使う"
    },
    "dictionary": {
      "type": "object",
      "additionalProperties": false,
      "default": {},
      "description": "M53: 辞書レイヤーの候補利用。Base は常に利用し、欠落した辞書 pack は空のレイヤーとして扱う",
      "properties": {
        "sudachiEnabled": { "type": "boolean", "default": true },
        "neologdEnabled": { "type": "boolean", "default": false },
        "namedEntityEnabled": { "type": "boolean", "default": true },
        "technicalTermsEnabled": { "type": "boolean", "default": true },
        "userDictionaryEnabled": { "type": "boolean", "default": true },
        "autoWordsEnabled": { "type": "boolean", "default": true },
        "appSpecificDictionaryEnabled": { "type": "boolean", "default": true }
      }
    },
    "autoWordRegistration": {
      "type": "object",
      "description": "M36: 新語の自動取得・辞書追加; docs/auto-word-registration-spec.md section 8",
      "properties": {
        "miningEnabled": { "type": "boolean", "default": true },
        "trendingEnabled": { "type": "boolean", "default": false },
        "registrationMode": { "type": "string", "enum": ["confirm", "auto"], "default": "confirm" },
        "miningMinCount": { "type": "integer", "default": 3, "minimum": 1, "maximum": 100 },
        "trendingIntervalHours": { "type": "integer", "default": 24, "minimum": 1, "maximum": 8760 }
      },
      "additionalProperties": false
    },
    "reranker": {
      "type": "object",
      "description": "Track B NLL reranking; docs/neural-reranker-spec.md section B9",
      "properties": {
        "nllRerankEnabled": { "type": "boolean", "default": false },
        "nllTopK": { "type": "integer", "default": 8, "minimum": 1, "maximum": 16 },
        "nllWeight": { "type": "number", "default": 0.15, "minimum": 0, "maximum": 1 },
        "nllBudgetMs": { "type": "integer", "default": 20, "minimum": 5, "maximum": 60 },
        "nllFailureThreshold": { "type": "integer", "default": 3, "minimum": 1, "maximum": 10 }
      },
      "additionalProperties": false
    },
    "autoUpdate": {
      "type": "object",
      "description": "Phase 7 (M32): 自動更新設定",
      "properties": {
        "enabled": { "type": "boolean", "default": true },
        "channel": { "type": "string", "enum": ["stable", "beta"], "default": "stable" },
        "checkIntervalHours": { "type": "integer", "default": 24, "minimum": 1 }
      },
      "additionalProperties": false
    },
    "safeMode": {
      "type": "object",
      "description": "M47: Host 連続クラッシュ時の安全モード状態。Host が記録し、解除はユーザーだけが行う。docs/dev-infrastructure-spec.md section 8.5.3",
      "properties": {
        "enabled": { "type": "boolean", "default": false },
        "enteredAt": { "type": "string", "description": "RFC 3339 タイムスタンプ（UTC）" },
        "lastCrashCount": { "type": "integer", "default": 0, "minimum": 0 }
      },
      "additionalProperties": false
    }
  },
  "additionalProperties": false
}
