{
  "inputMode": "hiragana",
  "profilesByApp": {},
  "bracketPairing": false,
  "bracketPairsPath": "",
  "bracketPairingAppPolicy": "denylist",
  "bracketPairingApps": [],
  "bracketSymmetricQuotePairing": false,
  "bracketWrapSelection": false,
  "bracketPairingTrigger": "immediate",
  "bracketSkipOverClosing": true,
  "bracketBackspaceDeletesPair": true,
  "bracketPairingInAlnumMode": true,
  "liveConversion": false,
  "dynamicPunctuation": false,
  "dynamicPunctuationStyle": "ja",
  "dynamicPunctuationStability": "onPause",
  "dynamicPunctuationIdleMs": 400,
  "segmentBoundaryConfidence": 0.5,
  "punctuationConversion": "off",
  "punctuationRulesPath": "%LOCALAPPDATA%\\azooKey\\punctuation-rules.tsv",
  "llmMagicConversion": false,
  "logLevel": "info",
  "inputStyle": "default",
  "customRomajiTablePath": "%LOCALAPPDATA%\\azooKey\\custom-romaji.tsv",
  "predictionEnabled": true,
  "aiBackend": "none",
  "openAiTimeoutMs": 30000,
  "privacy": {"mode": "normal", "redactLogs": true, "crashReportConsent": "off", "custom": {"learning": false, "prediction": true, "aiCandidate": true, "externalAi": false, "detailedLogging": false}, "autoSecureInput": true, "secureApps": [], "showSecureIndicator": true},
  "openAiApiKey": "",
  "openAiApiEndpoint": "https://api.openai.com/v1",
  "openAiModel": "gpt-4o-mini",
  "includeContextInAITransform": true,
  "contextReselection": false,
  "postCommitLint": false,
  "retroactiveRecompute": false,
  "sentenceCompletion": false,
  "backendPreference": "auto",
  "epPreference": "auto",
  "model": {
    "enabled": true,
    "selectedPath": "",
    "backendPreference": "auto",
    "epPreference": "auto",
    "nGpuLayers": -1,
    "autoLoadOnHostStart": true,
    "fallbackToSimpleConverter": true,
    "benchmarkOnModelChange": false,
    "benchmarkHistory": []
  },
  "powerProfile": "auto",
  "inferenceThreads": 0,
  "maxCandidates": 9,
  "maxContextLength": 30,
  "promptPrefixByApp": {},
  "batchRomajiConversion": false,
  "batchRomajiPreviewStyle": "kana",
  "batchConversionMode": "neural",
  "batchAutoPunctuation": false,
  "inlineEnglishCandidates": false,
  "inlineEnglishCaseVariants": true,
  "fullWidthEnglishCandidate": false,
  "inlineEnglishMinLength": 2,
  "inlineEnglishPromoteThreshold": 0.6,
  "inlineEnglishDictionary": false,
  "inlineEnglishDictionaryPath": "%LOCALAPPDATA%\\azooKey\\dict\\english-words.tsv",
  "numberRewriter": false,
  "katakanaRewriter": false,
  "symbolRewriter": false,
  "symbolDataPath": "",
  "emojiRewriter": false,
  "emojiTriggerSearch": true,
  "emojiMaxCandidates": 12,
  "emojiTriggerMinQueryLength": 1,
  "emojiDataPath": "",
  "typoCorrectionMode": "suggest",
  "typoMinCount": 3,
  "dictionary": {
    "sudachiEnabled": true,
    "neologdEnabled": false,
    "namedEntityEnabled": true,
    "technicalTermsEnabled": true,
    "userDictionaryEnabled": true,
    "autoWordsEnabled": true,
    "appSpecificDictionaryEnabled": true
  },
  "autoWordRegistration": {
    "miningEnabled": true,
    "trendingEnabled": false,
    "registrationMode": "confirm",
    "miningMinCount": 3,
    "trendingIntervalHours": 24
  },
  "reranker": {
    "nllRerankEnabled": false,
    "nllTopK": 8,
    "nllWeight": 0.15,
    "nllBudgetMs": 20,
    "nllFailureThreshold": 3
  },
  "autoUpdate": {
    "enabled": true,
    "channel": "stable",
    "checkIntervalHours": 24
  },
  "safeMode": {
    "enabled": false,
    "lastCrashCount": 0
  }
}
